{
  "schema_version": 1,
  "id": "apple-m3-ultra-96gb",
  "name": "Apple M3 Ultra (96 GB)",
  "vendor": "apple",
  "kind": "soc",
  "memory_gb": 96,
  "memory_type": "LPDDR5",
  "memory_bandwidth_gbs": 819,
  "compute": {
    "arch": "apple-gpu-g15",
    "cores": 60,
    "fp32_tflops": 24.0,
    "fp16_tflops": 48.0
  },
  "tdp_w": 180,
  "release_year": 2025,
  "msrp_usd": 3999,
  "typical_cloud_usd_per_h": null,
  "form_factor": "desktop",
  "notes": "Base Mac Studio M3 Ultra: 60-core GPU, 96 GB. The 80-core / 512 GB part is a different id. FP32/FP16 are estimates scaled from the M3 Max; Apple publishes no tensor numbers. TDP is a package estimate.",
  "detect": {
    "apple_chip": [
      "Apple M3 Ultra"
    ],
    "memory_gb": 96
  }
}
