{
  "schema_version": 1,
  "id": "nvidia-rtx-5090",
  "name": "NVIDIA GeForce RTX 5090",
  "vendor": "nvidia",
  "kind": "gpu",
  "memory_gb": 32,
  "memory_type": "GDDR7",
  "memory_bandwidth_gbs": 1792,
  "compute": {
    "arch": "blackwell",
    "sm": "12.0",
    "cores": 21760,
    "fp32_tflops": 104.8,
    "fp16_tflops": 209.5,
    "bf16_tflops": 209.5,
    "fp8_tflops": 419.0,
    "fp4_tflops": 838.0,
    "int8_tops": 838.0
  },
  "tdp_w": 575,
  "release_year": 2025,
  "msrp_usd": 1999,
  "typical_cloud_usd_per_h": null,
  "form_factor": "pcie",
  "notes": "Dense tensor figures. The first consumer card with an FP4 tensor path, which is why NVFP4 quantizations are worth testing here.",
  "detect": {
    "nvidia_smi_name": [
      "NVIDIA GeForce RTX 5090"
    ]
  }
}
