{
  "schema_version": 1,
  "id": "amd-rx-7900xtx",
  "name": "AMD Radeon RX 7900 XTX",
  "vendor": "amd",
  "kind": "gpu",
  "memory_gb": 24,
  "memory_type": "GDDR6",
  "memory_bandwidth_gbs": 960,
  "compute": {
    "arch": "rdna3",
    "cores": 6144,
    "fp32_tflops": 61.4,
    "fp16_tflops": 122.8,
    "bf16_tflops": 122.8,
    "int8_tops": 122.8
  },
  "tdp_w": 355,
  "release_year": 2022,
  "msrp_usd": 999,
  "typical_cloud_usd_per_h": null,
  "form_factor": "pcie",
  "notes": "Consumer RDNA3. ROCm support is workable on Linux but engine coverage is thinner than on CUDA; llama.cpp via Vulkan or ROCm is the usual path.",
  "detect": {
    "rocm_smi_name": [
      "Radeon RX 7900 XTX",
      "AMD Radeon RX 7900 XTX"
    ]
  }
}
