{
  "schema_version": 1,
  "id": "nvidia-b200",
  "name": "NVIDIA B200 192GB (SXM6)",
  "vendor": "nvidia",
  "kind": "gpu",
  "memory_gb": 192,
  "memory_type": "HBM3e",
  "memory_bandwidth_gbs": 8000,
  "compute": {
    "arch": "blackwell",
    "sm": "10.0",
    "fp32_tflops": 80.0,
    "fp16_tflops": 2250.0,
    "bf16_tflops": 2250.0,
    "fp8_tflops": 4500.0,
    "fp4_tflops": 9000.0,
    "int8_tops": 4500.0
  },
  "tdp_w": 1000,
  "release_year": 2025,
  "msrp_usd": null,
  "typical_cloud_usd_per_h": 6.5,
  "form_factor": "sxm",
  "notes": "Dense tensor figures derived from NVIDIA's sparse headline numbers; treat them as approximate. MSRP is not publicly listed.",
  "detect": {
    "nvidia_smi_name": [
      "NVIDIA B200"
    ]
  }
}
