{
  "schema_version": 1,
  "id": "nvidia-a100-80gb",
  "name": "NVIDIA A100 80GB (SXM4)",
  "vendor": "nvidia",
  "kind": "gpu",
  "memory_gb": 80,
  "memory_type": "HBM2e",
  "memory_bandwidth_gbs": 2039,
  "compute": {
    "arch": "ampere",
    "sm": "8.0",
    "cores": 6912,
    "fp32_tflops": 19.5,
    "fp16_tflops": 312.0,
    "bf16_tflops": 312.0,
    "int8_tops": 624.0
  },
  "tdp_w": 400,
  "release_year": 2020,
  "msrp_usd": null,
  "typical_cloud_usd_per_h": 1.8,
  "form_factor": "sxm",
  "notes": "SXM4 variant; the PCIe card has 1935 GB/s and a 300 W TDP and should be a separate id if it is ever measured. Dense tensor figures. No FP8 path. MSRP is not publicly listed for SXM parts.",
  "detect": {
    "nvidia_smi_name": [
      "NVIDIA A100-SXM4-80GB",
      "NVIDIA A100 80GB PCIe"
    ]
  }
}
