{
  "schema_version": 1,
  "id": "intel-arc-a770",
  "name": "Intel Arc A770 16GB",
  "vendor": "intel",
  "kind": "gpu",
  "memory_gb": 16,
  "memory_type": "GDDR6",
  "memory_bandwidth_gbs": 560,
  "compute": {
    "arch": "xe-hpg",
    "cores": 4096,
    "fp32_tflops": 19.7,
    "fp16_tflops": 39.3,
    "int8_tops": 157.3
  },
  "tdp_w": 225,
  "release_year": 2022,
  "msrp_usd": 349,
  "typical_cloud_usd_per_h": null,
  "form_factor": "pcie",
  "notes": "XMX matrix-engine figures. Engine support is the constraint, not the silicon: llama.cpp (SYCL/Vulkan) and IPEX-LLM work, vLLM's XPU backend is experimental.",
  "detect": {
    "lspci": [
      "Intel Corporation DG2 [Arc A770]"
    ],
    "nvidia_smi_name": []
  }
}
