{
  "schema_version": 1,
  "id": "amd-mi300x",
  "name": "AMD Instinct MI300X",
  "vendor": "amd",
  "kind": "gpu",
  "memory_gb": 192,
  "memory_type": "HBM3",
  "memory_bandwidth_gbs": 5300,
  "compute": {
    "arch": "cdna3",
    "cores": 19456,
    "fp32_tflops": 163.4,
    "fp16_tflops": 1307.4,
    "bf16_tflops": 1307.4,
    "fp8_tflops": 2614.9,
    "int8_tops": 2614.9
  },
  "tdp_w": 750,
  "release_year": 2023,
  "msrp_usd": null,
  "typical_cloud_usd_per_h": 2.5,
  "form_factor": "sxm",
  "notes": "Dense matrix-core figures. ROCm only; vLLM and SGLang both support it but the quantization format support differs from CUDA (no NVFP4).",
  "detect": {
    "rocm_smi_name": [
      "AMD Instinct MI300X",
      "MI300X"
    ]
  }
}
